{"candidate_identity_sha256":"6167ce961bf5c477e23774c55a7086fbf1327c8a091c35704c494d4a96b77b47","candidates":[{"benchmark":{"commit":"bca50f854199f61225bbab22b653dbcab882315a","repository":"leanprover/lean-eval"},"candidate_sha256":"2ec5a6e11fd1e08cc89b4a7882c89c4bfcba07446583289d7276517bbd638f74","declared_model":"GPT-5.6","github_resolution_sha256":"f215844fe41b26be9820e90b33ea962dd91b99c424f9874986b660fd32c88aa2","historical_accepted_at":"2026-07-12T22:21:05Z","historical_evaluation":{"workflow_contract":"split_repository_recorded_benchmark_v1","workflow_definition_sha256":"fa0889fb632a5856ec8c86a87c2c3e4f305409d927eb31b492198ea3990fbd1a","workflow_repository_commit":"fbe517bd4569f2f07c691a14cbff968970805498","workflow_run_attempt":1,"workflow_run_id":29209732320,"workflow_run_identity_sha256":"b1aec3e6787836149676c6da5c66855f565bd7df21916214596fc02f8b42156d"},"issue":{"identity_sha256":"660d750a72db98be4f2c8888ebfcbad22bd1e0a19e0c7886bc30c837771e3738","number":751,"repository":"leanprover/lean-eval-submissions"},"issue_candidates":[{"repository":"leanprover/lean-eval","status":"issue_not_found"},{"repository":"leanprover/lean-eval-submissions","status":"matched_source_unavailable"}],"owner_login":"morgan-griffiths","proposed_rationale_code":"accepted_immutable_source_ref_unavailable_without_archive","proposed_reason_code":"source_ref_permanently_unavailable","request_id":"prr_fd39939af724d041e6b0c912cd2ac8e647346df41341e8603176d942e429ae41","results":[{"owner_login":"morgan-griffiths","problem_id":"sard_theorem","result_file_sha256":"485283776d6e9bdacac1c039b8911e1ac80ad8e26421bc7e9af9b902cda8635b","result_id":"r2_7fd33f85e5c81db3c0b33b457d8168ecedb12be8bdf2ec3328f399121114a8c8","result_tree_digest":"76fb35dcb60f403fda7a760e5821161c9990d1a04d8c1e88582d084b8ae808ca","results_commit":"844ade95c0a432e63a84798f84969b8d9f2f53a3","results_path":"results/morgan-griffiths.json","results_repository":"leanprover/lean-eval-submissions","statement_revision":1}],"review_status":"pending","source":{"commit":"532c8124f570a0a8b7684d05e05f31142585a72a","kind":"gist","repository":"Morgan-Griffiths/fa7499915002fdf2211ad111372c4cda","visibility":"public"}},{"benchmark":{"commit":"bca50f854199f61225bbab22b653dbcab882315a","repository":"leanprover/lean-eval"},"candidate_sha256":"6e4fead991ae98dedaac8b0208bfaab57c38c5e1c453109fa1ddf532805b1d5a","declared_model":"GPT-5.6","github_resolution_sha256":"98f99067c4d1b431ade1ae7c0e1a961db7d09e9d96b27019d85f9a5a64c96a33","historical_accepted_at":"2026-07-10T08:06:22Z","historical_evaluation":{"workflow_contract":"split_repository_recorded_benchmark_v1","workflow_definition_sha256":"fa0889fb632a5856ec8c86a87c2c3e4f305409d927eb31b492198ea3990fbd1a","workflow_repository_commit":"b3422c0bd12da89a93bdd297a7810000686fd1a9","workflow_run_attempt":1,"workflow_run_id":29077802711,"workflow_run_identity_sha256":"bd8f838a20487c7a2c5027c78d7eca8bf0dd3184c96734a9cb4b6023ba1751bc"},"issue":{"identity_sha256":"1ae894b476f004e82cad630d19711f14c55b82365e0d670dfb3c28a0cbfbbabe","number":639,"repository":"leanprover/lean-eval-submissions"},"issue_candidates":[{"repository":"leanprover/lean-eval","status":"issue_not_found"},{"repository":"leanprover/lean-eval-submissions","status":"matched_source_unavailable"}],"owner_login":"morgan-griffiths","proposed_rationale_code":"accepted_immutable_source_ref_unavailable_without_archive","proposed_reason_code":"source_ref_permanently_unavailable","request_id":"prr_fd484d94473c79bfa99139c70737ed3cfb71db086888a81adf8fd1d236ab31cd","results":[{"owner_login":"morgan-griffiths","problem_id":"dirichlet_eigenvalues_eq_nat_sq","result_file_sha256":"485283776d6e9bdacac1c039b8911e1ac80ad8e26421bc7e9af9b902cda8635b","result_id":"r2_d4bded3d41f3160cc37b856faae967802e105604d0350dfc0c45bb312e83159d","result_tree_digest":"76fb35dcb60f403fda7a760e5821161c9990d1a04d8c1e88582d084b8ae808ca","results_commit":"844ade95c0a432e63a84798f84969b8d9f2f53a3","results_path":"results/morgan-griffiths.json","results_repository":"leanprover/lean-eval-submissions","statement_revision":1}],"review_status":"pending","source":{"commit":"70c279d1732fb56710cfc5805a32bef1929fd8c5","kind":"gist","repository":"Morgan-Griffiths/80ae1ccc77ca273c9c1833bb1b960a8f","visibility":"public"}},{"benchmark":{"commit":"9921ef5c57b8d9eaa31b64a7e2d68cf53a388c66","repository":"leanprover/lean-eval"},"candidate_sha256":"5b9d4140daca0b4d41b86ef2035ccd40c7caa97ac6397deb5de5105f54cd580e","declared_model":"Aristotle (Harmonic)","github_resolution_sha256":"69d58954158cffc75f43455cefc41f461c0bc08ecab74fd3d89e96d03440dba0","historical_accepted_at":"2026-05-16T20:59:18Z","historical_evaluation":{"workflow_contract":"benchmark_repository_head","workflow_definition_sha256":"a81d21d2c6ab02a14e5a30d675b4ba6bb532e9afb9251aa4170cc21fcd5d2960","workflow_repository_commit":"9921ef5c57b8d9eaa31b64a7e2d68cf53a388c66","workflow_run_attempt":1,"workflow_run_id":25972626298,"workflow_run_identity_sha256":"1f14d532e91173c9173163c7f9b9cdd6526383daa0504d02db770490524b0909"},"issue":{"identity_sha256":"50fac8eedb6e6bbd542dd91d3264d3a8cf0884c27f596a46b74b05f11a235f7c","number":261,"repository":"leanprover/lean-eval"},"issue_candidates":[{"repository":"leanprover/lean-eval","status":"matched_source_unavailable"},{"repository":"leanprover/lean-eval-submissions","status":"source_mismatch"}],"owner_login":"lorenzoluccioli","proposed_rationale_code":"accepted_immutable_source_ref_unavailable_without_archive","proposed_reason_code":"source_ref_permanently_unavailable","request_id":"prr_fe48499d222f9fc329f7e75265fbd6d28cbafad49a3cfa99ee712f41d672bb9a","results":[{"owner_login":"lorenzoluccioli","problem_id":"rouche_zero_count_eq","result_file_sha256":"12b8504ca72ef73e31a7a757d0a5f9726fec309512486c58c787ca0ae78ab8f4","result_id":"r2_8c400c08cd7a1655a93960ff71076830270154a9ee681beb9270f0bd470d2be6","result_tree_digest":"96cbe5ae5622ea96a48b34da3416e65efb181acb51e2e28e0ea71117cf3ce78d","results_commit":"844ade95c0a432e63a84798f84969b8d9f2f53a3","results_path":"results/lorenzoluccioli.json","results_repository":"leanprover/lean-eval-submissions","statement_revision":1}],"review_status":"pending","source":{"commit":"8ed098c66c24d6da96ea1e7de6489aa4aaf30a60","kind":"github_repo","repository":"LorenzoLuccioli/lean-eval","visibility":"public"}}],"first_request_id":"prr_fd39939af724d041e6b0c912cd2ac8e647346df41341e8603176d942e429ae41","kind":"historical_public_replay_unavailability_candidate_shard","last_request_id":"prr_fe48499d222f9fc329f7e75265fbd6d28cbafad49a3cfa99ee712f41d672bb9a","request_count":3,"result_count":3,"schema_version":1,"shard_count":7,"shard_index":6}
